{
  "schemaVersion": "1.0",
  "type": "common-spec",
  "title": "灯台データベース 共通仕様",
  "status": "draft",
  "updated": "2026-08-25",
  "rules": [
    {
      "id": "COM-001",
      "name": "日付表示形式",
      "statement": "日付は「YYYY/MM/DD」形式で表示する",
      "testNote": "一覧・詳細・入力初期値のすべてで確認する（H-DISP-08）"
    },
    {
      "id": "COM-002",
      "name": "エラー表示方式",
      "statement": "処理失敗のエラーは画面右下のトーストで5秒間表示する",
      "testNote": "通信失敗・検索失敗の双方で表示位置と消え方を確認する（H-NET-01）"
    },
    {
      "id": "COM-003",
      "name": "二重実行防止",
      "statement": "検索・更新の処理中は、起因となったボタンを操作不可にする",
      "testNote": "ボタンの連打で処理が二重に実行されないことを確認する（H-NAV-01, H-CONC-05）"
    },
    {
      "id": "COM-004",
      "name": "一覧の0件表示",
      "statement": "一覧はデータ0件のとき「該当するデータがありません」と表示する",
      "testNote": "画面側 emptyBehavior に個別文言がある場合はそちらを正とする（H-DISP-01）"
    },
    {
      "id": "COM-005",
      "name": "一覧の件数表示",
      "statement": "一覧の上部に、条件に合致する全件数を「N件」の形式で表示する",
      "testNote": "検索条件の変更後に件数表示が追随することを確認する"
    }
  ],
  "notes": [
    "各画面仕様書はこのファイルの全ルールを暗黙に継承する。逸脱する画面は overrides に rule / behavior / reason を宣言する。"
  ]
}
