{
  "schemaVersion": "1.0",
  "type": "common-spec",
  "title": "<プロジェクト名> 共通仕様",
  "status": "draft",
  "updated": "<YYYY-MM-DD>",
  "rules": [
    {
      "id": "COM-001",
      "name": "日付表示形式",
      "statement": "<例: 日付は「YYYY/MM/DD」形式で表示する>",
      "testNote": "<例: 一覧・詳細・入力初期値のすべてで確認する（H-DISP-08）>"
    },
    {
      "id": "COM-002",
      "name": "エラー表示方式",
      "statement": "<例: 処理失敗のエラーは画面右下のトーストで5秒間表示する>",
      "testNote": "<例: 通信失敗・保存失敗の双方で表示位置と消え方を確認する（H-NET-01）>"
    },
    {
      "id": "COM-003",
      "name": "二重送信防止",
      "statement": "<例: 更新系の処理中は、起因となったボタンを操作不可にする>",
      "testNote": "<例: 送信ボタンの連打で二重登録されないことを確認する（H-NAV-01, H-CONC-05）>"
    },
    {
      "id": "COM-004",
      "name": "一覧の0件表示",
      "statement": "<例: 一覧はデータ0件のとき「該当するデータがありません」と表示する>",
      "testNote": "<例: 画面側 emptyBehavior に個別文言がある場合はそちらを正とする（H-DISP-01）>"
    },
    {
      "id": "COM-005",
      "name": "ページング挙動",
      "statement": "<例: 一覧は50件ごとにページングし、最終ページでは次ページ操作を表示しない>",
      "testNote": "<例: 1ページちょうど・+1件・最終ページの境界を確認する（H-DISP-06）>"
    }
  ],
  "notes": [
    "ルール本文（statement）は画面の振る舞いの言葉で観測可能に書く。実装語（フレームワーク名・関数名・HTTPステータス番号）を持ち込まない。",
    "各画面仕様書はこのファイルの全ルールを暗黙に継承する。逸脱する画面は overrides に rule / behavior / reason を宣言する（reason 必須）。",
    "overrides 宣言なしに共通仕様と矛盾する画面側の記述は、lint とレビューで書き揺れとして扱う。",
    "このファイルは spec-to-test の横断観点の導出元になる。0件表示・二重送信のような『仕様に明記されにくい汎用観点』の期待値はここに置く。"
  ]
}
